Date,Platform,Category,Title,Format,CTA
2025-10-03,Instagram Reel,FinTech_UPI,How Google Pay delivers groceries in 10 minutes during monsoon season?,Reel Hook,Follow for more System Design 🚀
2025-10-04,Instagram Carousel,Streaming_Entertainment,How Hotstar prevents fraud during massive transaction spikes?,Carousel Explainer,Share this with your team 📤
2025-10-05,YouTube Short,Social_Content,How Koo prevents fraud during massive transaction spikes?,Short Hook,Tag a friend who should know this 👀
2025-10-06,LinkedIn Post,FinTech_UPI,How Stripe handles OTT load during India vs Pakistan match?,Post + Carousel,Share this with your team 📤
2025-10-07,Instagram Reel,Streaming_Entertainment,How JioCinema balances rides during Bangalore peak traffic?,Reel Hook,Save this for later 🔖
2025-10-08,Instagram Carousel,FinTech_UPI,How Coinbase handles school exam traffic on edtech live platforms?,Carousel Explainer,Share this with your team 📤
2025-10-09,YouTube Short,Telecom_Infra,How Vi handles school exam traffic on edtech live platforms?,Short Hook,Comment your thoughts 💬
2025-10-10,LinkedIn Post,Telecom_Infra,How Airtel survives Holi weekend delivery spikes?,Post + Carousel,Tag a friend who should know this 👀
2025-10-11,Instagram Reel,Mobility_Travel,How Air India handles crores of UPI payments during Diwali shopping?,Reel Hook,Tag a friend who should know this 👀
2025-10-12,Instagram Carousel,Social_Content,How Koo survives Big Billion Day sales without crashing?,Carousel Explainer,Share this with your team 📤
2025-10-13,YouTube Short,FinTech_UPI,How Razorpay prevents downtime during G20 summit streaming?,Short Hook,Save this for later 🔖
2025-10-14,LinkedIn Post,FinTech_UPI,How Cred optimizes surge pricing during floods and heavy rains?,Post + Carousel,Share this with your team 📤
2025-10-15,Instagram Reel,EdTech,How Unacademy books Tatkal tickets at 10 AM for lakhs of users?,Reel Hook,Comment your thoughts 💬
2025-10-16,Instagram Carousel,Ecommerce,How Flipkart keeps grocery supply chain running during lockdown-like rush?,Carousel Explainer,Follow for more System Design 🚀
2025-10-17,YouTube Short,Streaming_Entertainment,How Netflix handles OTT load during India vs Pakistan match?,Short Hook,Follow for more System Design 🚀
2025-10-18,LinkedIn Post,EdTech,How Unacademy keeps grocery supply chain running during lockdown-like rush?,Post + Carousel,Share this with your team 📤
2025-10-19,Instagram Reel,EdTech,How BYJU's keeps systems up during Independence Day midnight traffic surge?,Reel Hook,Share this with your team 📤
2025-10-20,Instagram Carousel,Streaming_Entertainment,How BookMyShow handles school exam traffic on edtech live platforms?,Carousel Explainer,Save this for later 🔖
2025-10-21,YouTube Short,Gaming,How MPL processes crores of recharge requests during network outages?,Short Hook,Share this with your team 📤
2025-10-22,LinkedIn Post,Social_Content,How Instagram keeps systems up during Independence Day midnight traffic surge?,Post + Carousel,Share this with your team 📤
2025-10-23,Instagram Reel,Streaming_Entertainment,How Hotstar keeps systems up during Independence Day midnight traffic surge?,Reel Hook,Follow for more System Design 🚀
2025-10-24,Instagram Carousel,FinTech_UPI,How Stripe delivers fashion orders during End of Reason Sale?,Carousel Explainer,Save this for later 🔖
2025-10-25,YouTube Short,Ecommerce,How Myntra prevents fraud during massive transaction spikes?,Short Hook,Tag a friend who should know this 👀
2025-10-26,LinkedIn Post,Social_Content,How Moj handles crores of UPI payments during Diwali shopping?,Post + Carousel,Comment your thoughts 💬
2025-10-27,Instagram Reel,Gaming,How Dream11 delivers groceries in 10 minutes during monsoon season?,Reel Hook,Follow for more System Design 🚀
2025-10-28,Instagram Carousel,Mobility_Travel,How IndiGo books Tatkal tickets at 10 AM for lakhs of users?,Carousel Explainer,Save this for later 🔖
2025-10-29,YouTube Short,EdTech,How BYJU's delivers sweets and gifts during Raksha Bandhan spike?,Short Hook,Share this with your team 📤
2025-10-30,LinkedIn Post,Social_Content,How ShareChat handles traffic surge during Coldplay concert ticket sales?,Post + Carousel,Comment your thoughts 💬
2025-10-31,Instagram Reel,Ecommerce,How Amazon Prime Day streams live World Cup cricket matches without buffering?,Reel Hook,Save this for later 🔖
2025-11-01,Instagram Carousel,Ecommerce,How Flipkart optimizes surge pricing during floods and heavy rains?,Carousel Explainer,Comment your thoughts 💬
2025-11-02,YouTube Short,Streaming_Entertainment,How Gaana books Tatkal tickets at 10 AM for lakhs of users?,Short Hook,Comment your thoughts 💬
2025-11-03,LinkedIn Post,Food_Delivery,How Uber Eats manages FASTag tolls for millions of cars daily?,Post + Carousel,Comment your thoughts 💬
2025-11-04,Instagram Reel,Gaming,How BGMI keeps systems up during Independence Day midnight traffic surge?,Reel Hook,Save this for later 🔖
2025-11-05,Instagram Carousel,Gaming,How MPL processes crores of recharge requests during network outages?,Carousel Explainer,Follow for more System Design 🚀
2025-11-06,YouTube Short,Mobility_Travel,How Rapido runs fantasy leagues for crores of users in IPL finals?,Short Hook,Comment your thoughts 💬
2025-11-07,LinkedIn Post,Social_Content,How Josh optimizes surge pricing during floods and heavy rains?,Post + Carousel,Tag a friend who should know this 👀
2025-11-08,Instagram Reel,FinTech_UPI,How Cred survives Big Billion Day sales without crashing?,Reel Hook,Save this for later 🔖
2025-11-09,Instagram Carousel,EdTech,How BYJU's ships lakhs of orders during Great Indian Festival?,Carousel Explainer,Save this for later 🔖
2025-11-10,YouTube Short,Mobility_Travel,How IndiGo prevents downtime during G20 summit streaming?,Short Hook,Follow for more System Design 🚀
2025-11-11,LinkedIn Post,Gaming,How MPL processes lakhs of stock trades during Budget Day?,Post + Carousel,Tag a friend who should know this 👀
2025-11-12,Instagram Reel,Social_Content,How Josh survives Big Billion Day sales without crashing?,Reel Hook,Follow for more System Design 🚀
2025-11-13,Instagram Carousel,Ecommerce,How Amazon India keeps systems up during Independence Day midnight traffic surge?,Carousel Explainer,Comment your thoughts 💬
2025-11-14,YouTube Short,Mobility_Travel,How Air India prevents fraud during massive transaction spikes?,Short Hook,Save this for later 🔖
2025-11-15,LinkedIn Post,Food_Delivery,How Instacart processes lakhs of stock trades during Budget Day?,Post + Carousel,Comment your thoughts 💬
2025-11-16,Instagram Reel,Mobility_Travel,How Uber India streams Bollywood blockbusters to millions on Friday night?,Reel Hook,Comment your thoughts 💬
2025-11-17,Instagram Carousel,EdTech,How BYJU's handles crores of UPI payments during Diwali shopping?,Carousel Explainer,Save this for later 🔖
2025-11-18,YouTube Short,Ecommerce,How Amazon India books Tatkal tickets at 10 AM for lakhs of users?,Short Hook,Save this for later 🔖
2025-11-19,LinkedIn Post,Mobility_Travel,How Ola balances rides during Bangalore peak traffic?,Post + Carousel,Share this with your team 📤
2025-11-20,Instagram Reel,Telecom_Infra,How Shadowfax books Tatkal tickets at 10 AM for lakhs of users?,Reel Hook,Comment your thoughts 💬
2025-11-21,Instagram Carousel,Mobility_Travel,How Air India delivers food during IPL finals when millions order at once?,Carousel Explainer,Tag a friend who should know this 👀
2025-11-22,YouTube Short,Food_Delivery,How Swiggy runs fantasy leagues for crores of users in IPL finals?,Short Hook,Comment your thoughts 💬
2025-11-23,LinkedIn Post,Food_Delivery,How Swiggy prevents fraud during massive transaction spikes?,Post + Carousel,Follow for more System Design 🚀
2025-11-24,Instagram Reel,Mobility_Travel,How Ola survives Big Billion Day sales without crashing?,Reel Hook,Tag a friend who should know this 👀
2025-11-25,Instagram Carousel,Telecom_Infra,How Shadowfax ships lakhs of orders during Great Indian Festival?,Carousel Explainer,Comment your thoughts 💬
2025-11-26,YouTube Short,Telecom_Infra,How Airtel prevents downtime during G20 summit streaming?,Short Hook,Tag a friend who should know this 👀
2025-11-27,LinkedIn Post,Ecommerce,How Snapdeal handles traffic surge during Coldplay concert ticket sales?,Post + Carousel,Save this for later 🔖
2025-11-28,Instagram Reel,Mobility_Travel,How Ola delivers fashion orders during End of Reason Sale?,Reel Hook,Comment your thoughts 💬
2025-11-29,Instagram Carousel,Mobility_Travel,How MakeMyTrip balances rides during Bangalore peak traffic?,Carousel Explainer,Tag a friend who should know this 👀
2025-11-30,YouTube Short,Gaming,How PUBG Mobile streams cricket to 30 million concurrent viewers?,Short Hook,Tag a friend who should know this 👀
2025-12-01,LinkedIn Post,Ecommerce,How Amazon India runs fantasy leagues for crores of users in IPL finals?,Post + Carousel,Share this with your team 📤
2025-12-02,Instagram Reel,Streaming_Entertainment,How Sony Liv runs fantasy leagues for crores of users in IPL finals?,Reel Hook,Share this with your team 📤
2025-12-03,Instagram Carousel,Gaming,How Ludo King keeps grocery supply chain running during lockdown-like rush?,Carousel Explainer,Follow for more System Design 🚀
2025-12-04,YouTube Short,Social_Content,How Moj optimizes surge pricing during floods and heavy rains?,Short Hook,Share this with your team 📤
2025-12-05,LinkedIn Post,Gaming,How PUBG Mobile processes lakhs of stock trades during Budget Day?,Post + Carousel,Comment your thoughts 💬
2025-12-06,Instagram Reel,Social_Content,How Koo survives Holi weekend delivery spikes?,Reel Hook,Save this for later 🔖
2025-12-07,Instagram Carousel,Ecommerce,How Nykaa keeps grocery supply chain running during lockdown-like rush?,Carousel Explainer,Tag a friend who should know this 👀
2025-12-08,YouTube Short,Social_Content,How WhatsApp prevents downtime during G20 summit streaming?,Short Hook,Follow for more System Design 🚀
2025-12-09,LinkedIn Post,Gaming,How Ludo King processes lakhs of stock trades during Budget Day?,Post + Carousel,Share this with your team 📤
2025-12-10,Instagram Reel,Social_Content,How Chingari handles OTT load during India vs Pakistan match?,Reel Hook,Follow for more System Design 🚀
2025-12-11,Instagram Carousel,Telecom_Infra,How Jio streams cricket to 30 million concurrent viewers?,Carousel Explainer,Tag a friend who should know this 👀
2025-12-12,YouTube Short,Social_Content,How ShareChat handles traffic surge during Coldplay concert ticket sales?,Short Hook,Comment your thoughts 💬
2025-12-13,LinkedIn Post,Telecom_Infra,How Shadowfax handles traffic surge during Coldplay concert ticket sales?,Post + Carousel,Save this for later 🔖
2025-12-14,Instagram Reel,Mobility_Travel,How MakeMyTrip processes lakhs of stock trades during Budget Day?,Reel Hook,Follow for more System Design 🚀
2025-12-15,Instagram Carousel,Telecom_Infra,How Delhivery survives Big Billion Day sales without crashing?,Carousel Explainer,Comment your thoughts 💬
2025-12-16,YouTube Short,EdTech,How Coursera handles school exam traffic on edtech live platforms?,Short Hook,Share this with your team 📤
2025-12-17,LinkedIn Post,Mobility_Travel,How RedBus delivers fashion orders during End of Reason Sale?,Post + Carousel,Save this for later 🔖
2025-12-18,Instagram Reel,Gaming,How Ludo King processes crores of recharge requests during network outages?,Reel Hook,Tag a friend who should know this 👀
2025-12-19,Instagram Carousel,Ecommerce,How Snapdeal keeps Black Friday shopping smooth in India?,Carousel Explainer,Share this with your team 📤
2025-12-20,YouTube Short,Ecommerce,How Amazon India delivers food during IPL finals when millions order at once?,Short Hook,Follow for more System Design 🚀
2025-12-21,LinkedIn Post,EdTech,How BYJU's manages cashback and offers during festive rush?,Post + Carousel,Follow for more System Design 🚀
2025-12-22,Instagram Reel,Streaming_Entertainment,How JioCinema processes lakhs of stock trades during Budget Day?,Reel Hook,Comment your thoughts 💬
2025-12-23,Instagram Carousel,Social_Content,How Koo delivers groceries in 10 minutes during monsoon season?,Carousel Explainer,Comment your thoughts 💬
2025-12-24,YouTube Short,Streaming_Entertainment,How JioCinema ships lakhs of orders during Great Indian Festival?,Short Hook,Save this for later 🔖
2025-12-25,LinkedIn Post,Social_Content,How ShareChat survives Big Billion Day sales without crashing?,Post + Carousel,Tag a friend who should know this 👀
2025-12-26,Instagram Reel,Ecommerce,How Amazon India handles traffic surge during Coldplay concert ticket sales?,Reel Hook,Follow for more System Design 🚀
2025-12-27,Instagram Carousel,Telecom_Infra,How Airtel delivers fashion orders during End of Reason Sale?,Carousel Explainer,Tag a friend who should know this 👀
2025-12-28,YouTube Short,Gaming,How MPL prevents downtime during G20 summit streaming?,Short Hook,Share this with your team 📤
2025-12-29,LinkedIn Post,Streaming_Entertainment,How JioCinema manages cashback and offers during festive rush?,Post + Carousel,Share this with your team 📤
2025-12-30,Instagram Reel,Gaming,How BGMI streams live World Cup cricket matches without buffering?,Reel Hook,Save this for later 🔖
2025-12-31,Instagram Carousel,FinTech_UPI,How Cred ships lakhs of orders during Great Indian Festival?,Carousel Explainer,Save this for later 🔖
