pillar,category,seed,title
DSA,DSA — Greedy & Intervals,Monotone queues for extrema,Why your Monotone queues for extrema TLEs at scale — and how to fix it
DSA,DSA — Greedy & Intervals,Activity selection,Read the prompt: keywords that scream Activity selection
DSA,DSA — Greedy & Intervals,Interval partitioning,Back-of-the-envelope complexity for Interval partitioning
DSA,DSA — Greedy & Intervals,Merge intervals,One trick that simplifies most Merge intervals questions
DSA,DSA — Greedy & Intervals,Minimum platforms,Stop re-deriving! Reusable template for Minimum platforms
DSA,DSA — Greedy & Intervals,Gas station,Edge vs corner cases — Gas station edition
DSA,DSA — Greedy & Intervals,Huffman coding,Checklist before coding Huffman coding
DSA,DSA — Greedy & Intervals,Scheduling with deadlines,Why proofs matter: exchange argument for Scheduling with deadlines
DSA,DSA — Greedy & Intervals,Fractional vs 0/1 knapsack (contrast),Counterexamples: when Fractional vs 0/1 knapsack (contrast) fails
DSA,DSA — Greedy & Intervals,Exchange argument,Greedy + heap combo patterns for Exchange argument
DSA,DSA — Greedy & Intervals,Jump game family,Intervals visualization grid for Jump game family
DSA,DSA — Greedy & Intervals,Candy/ratings,Edge cases: overlaps/equals in Candy/ratings
DSA,DSA — Greedy & Intervals,Monotone queues for extrema,Why Monotone queues for extrema scares 90% of interviewees (and how to master it)
DSA,DSA — Greedy & Intervals,Activity selection,Activity selection in 60 seconds — intuition first
DSA,DSA — Greedy & Intervals,Interval partitioning,Stop brute forcing: spot the Interval partitioning trigger words
DSA,DSA — Greedy & Intervals,Merge intervals,Merge intervals vs brute force — when to switch and why
DSA,DSA — Greedy & Intervals,Minimum platforms,Top 7 mistakes in Minimum platforms that cost offers
DSA,DSA — Greedy & Intervals,Gas station,From O(N^2) → O(N): optimize your Gas station
DSA,DSA — Greedy & Intervals,Huffman coding,"Huffman coding for beginners: visuals, patterns, pitfalls"
DSA,DSA — Greedy & Intervals,Scheduling with deadlines,Think like an interviewer: how I grade your Scheduling with deadlines
DSA,DSA — Greedy & Intervals,Fractional vs 0/1 knapsack (contrast),Whiteboard to code: Fractional vs 0/1 knapsack (contrast) with edge cases
DSA,DSA — Greedy & Intervals,Exchange argument,You don’t need to memorize — template for Exchange argument
DSA,DSA — Greedy & Intervals,Jump game family,"Jump game family cheat sheet: patterns, templates, tests"
DSA,DSA — Greedy & Intervals,Candy/ratings,Interview day checklist for Candy/ratings
DSA,DSA — Greedy & Intervals,Monotone queues for extrema,Draw this first: diagram that unlocks Monotone queues for extrema
DSA,DSA — Greedy & Intervals,Activity selection,The ‘aha!’ intuition behind Activity selection
DSA,DSA — Greedy & Intervals,Interval partitioning,Hidden constraints that break Interval partitioning
DSA,DSA — Greedy & Intervals,Merge intervals,Dry run like a pro: Merge intervals on real inputs
DSA,DSA — Greedy & Intervals,Minimum platforms,"Refactor a messy Minimum platforms into clean, fast code"
DSA,DSA — Greedy & Intervals,Gas station,Space vs time in Gas station: what to trade off
DSA,DSA — Greedy & Intervals,Huffman coding,Edge cases that break 8/10 Huffman coding submissions
DSA,DSA — Greedy & Intervals,Scheduling with deadlines,Prove correctness for Scheduling with deadlines in plain English
DSA,DSA — Greedy & Intervals,Fractional vs 0/1 knapsack (contrast),Phone screen vs onsite: Fractional vs 0/1 knapsack (contrast) differences
DSA,DSA — Greedy & Intervals,Exchange argument,Speedrun Exchange argument: archetypes you must know
DSA,DSA — Greedy & Intervals,Jump game family,Complexity showdown: naive vs optimal Jump game family
DSA,DSA — Greedy & Intervals,Candy/ratings,Debugging live: fix a broken Candy/ratings solution
DSA,DSA — Greedy & Intervals,Monotone queues for extrema,"Off-by-one, bounds, and overflow in Monotone queues for extrema"
DSA,DSA — Greedy & Intervals,Activity selection,Simplify before you optimize: Activity selection
DSA,DSA — Greedy & Intervals,Interval partitioning,"Mock interview: one Interval partitioning problem, full process"
DSA,DSA — Greedy & Intervals,Merge intervals,Unit tests that catch subtle Merge intervals bugs
DSA,DSA — Greedy & Intervals,Minimum platforms,When to use hash maps / sets with Minimum platforms
DSA,DSA — Greedy & Intervals,Gas station,Why your Gas station TLEs at scale — and how to fix it
DSA,DSA — Greedy & Intervals,Huffman coding,Read the prompt: keywords that scream Huffman coding
DSA,DSA — Greedy & Intervals,Scheduling with deadlines,Back-of-the-envelope complexity for Scheduling with deadlines
DSA,DSA — Greedy & Intervals,Fractional vs 0/1 knapsack (contrast),One trick that simplifies most Fractional vs 0/1 knapsack (contrast) questions
DSA,DSA — Greedy & Intervals,Exchange argument,Stop re-deriving! Reusable template for Exchange argument
DSA,DSA — Greedy & Intervals,Jump game family,Edge vs corner cases — Jump game family edition
DSA,DSA — Greedy & Intervals,Candy/ratings,Checklist before coding Candy/ratings
DSA,DSA — Greedy & Intervals,Monotone queues for extrema,Why proofs matter: exchange argument for Monotone queues for extrema
DSA,DSA — Greedy & Intervals,Activity selection,Counterexamples: when Activity selection fails
DSA,DSA — Greedy & Intervals,Interval partitioning,Greedy + heap combo patterns for Interval partitioning
DSA,DSA — Greedy & Intervals,Merge intervals,Intervals visualization grid for Merge intervals
DSA,DSA — Greedy & Intervals,Minimum platforms,Edge cases: overlaps/equals in Minimum platforms
DSA,DSA — Greedy & Intervals,Gas station,Why Gas station scares 90% of interviewees (and how to master it)
DSA,DSA — Greedy & Intervals,Huffman coding,Huffman coding in 60 seconds — intuition first
DSA,DSA — Greedy & Intervals,Scheduling with deadlines,Stop brute forcing: spot the Scheduling with deadlines trigger words
DSA,DSA — Greedy & Intervals,Fractional vs 0/1 knapsack (contrast),Fractional vs 0/1 knapsack (contrast) vs brute force — when to switch and why
DSA,DSA — Greedy & Intervals,Exchange argument,Top 7 mistakes in Exchange argument that cost offers
DSA,DSA — Greedy & Intervals,Jump game family,From O(N^2) → O(N): optimize your Jump game family
DSA,DSA — Greedy & Intervals,Candy/ratings,"Candy/ratings for beginners: visuals, patterns, pitfalls"
DSA,DSA — Greedy & Intervals,Monotone queues for extrema,Think like an interviewer: how I grade your Monotone queues for extrema
DSA,DSA — Greedy & Intervals,Activity selection,Whiteboard to code: Activity selection with edge cases
DSA,DSA — Greedy & Intervals,Interval partitioning,You don’t need to memorize — template for Interval partitioning
DSA,DSA — Greedy & Intervals,Merge intervals,"Merge intervals cheat sheet: patterns, templates, tests"
DSA,DSA — Greedy & Intervals,Minimum platforms,Interview day checklist for Minimum platforms
DSA,DSA — Greedy & Intervals,Gas station,Draw this first: diagram that unlocks Gas station
DSA,DSA — Greedy & Intervals,Huffman coding,The ‘aha!’ intuition behind Huffman coding
DSA,DSA — Greedy & Intervals,Scheduling with deadlines,Hidden constraints that break Scheduling with deadlines
DSA,DSA — Greedy & Intervals,Fractional vs 0/1 knapsack (contrast),Dry run like a pro: Fractional vs 0/1 knapsack (contrast) on real inputs
DSA,DSA — Greedy & Intervals,Exchange argument,"Refactor a messy Exchange argument into clean, fast code"
DSA,DSA — Greedy & Intervals,Jump game family,Space vs time in Jump game family: what to trade off
DSA,DSA — Greedy & Intervals,Candy/ratings,Edge cases that break 8/10 Candy/ratings submissions
DSA,DSA — Greedy & Intervals,Monotone queues for extrema,Prove correctness for Monotone queues for extrema in plain English
DSA,DSA — Greedy & Intervals,Activity selection,Cricket powerplay planning as Activity selection
DSA,DSA — Greedy & Intervals,Interval partitioning,Bengaluru metro transfers visualizing Interval partitioning
DSA,DSA — Greedy & Intervals,Merge intervals,Dabbawala routing intuition for Merge intervals
DSA,DSA — Greedy & Intervals,Minimum platforms,UPI retries mental model for Minimum platforms
DSA,DSA — Greedy & Intervals,Gas station,Cricket powerplay planning as Gas station
DSA,DSA — Greedy & Intervals,Huffman coding,Bengaluru metro transfers visualizing Huffman coding
DSA,DSA — Greedy & Intervals,Scheduling with deadlines,Dabbawala routing intuition for Scheduling with deadlines
DSA,DSA — Greedy & Intervals,Fractional vs 0/1 knapsack (contrast),UPI retries mental model for Fractional vs 0/1 knapsack (contrast)
